{"blocker":null,"budgets":{"minimum_no_novelty_rounds":2,"minimum_red_team_rounds":2,"paragraphs":3863,"registry_concepts":709,"tables":117},"capabilities":{"files":{"available":true,"limitations":[],"readable":true,"writable":true},"network":{"available":true,"limitations":[],"live_retrieval":true},"subagents":{"available":false,"isolated_roles":false,"limitations":["subagent API unavailable"],"max_parallelism":0},"validators":{"available":true,"executable":true,"limitations":[],"validator_ids":["schema","source-integrity","version-isolation","concept-closure","claim-path","retrieval","position","output","manifest","state-machine","continuation"]}},"completion_criteria":["source-closure","concept-closure","claim-path-closure","retrieval-and-counterexample-closure","position-lock","output-and-validator-closure"],"created_at":"2026-07-23T00:00:00+08:00","framework_version":"v8.0","mode":"promax-complete","orchestration_mode":"single-agent-separated","recommendation_required":true,"request_sha256":"b9f79081b8f9c5e5b89d7230094a3e51efa2a3d19060d03fd5b4c72e7afdc769","requested_skill_names":["crossframe-promax"],"role_plan":[{"exchange_protocol":"structured-artifacts-only","execution_mode":"single-agent-separated","role_id":"v8_source_concept_auditor","sequence":1},{"exchange_protocol":"structured-artifacts-only","execution_mode":"single-agent-separated","role_id":"external_case_researcher","sequence":2},{"exchange_protocol":"structured-artifacts-only","execution_mode":"single-agent-separated","role_id":"counterexample_auditor","sequence":3},{"exchange_protocol":"structured-artifacts-only","execution_mode":"single-agent-separated","role_id":"position_adjudicator","sequence":4},{"exchange_protocol":"structured-artifacts-only","execution_mode":"single-agent-separated","role_id":"longform_writer","sequence":5}],"routing_conflict":{"conflicting_names":[],"detected":false,"fallback_allowed":false,"priority_rule":"routing-priority-crossframe-promax-over-crossframe-max-no-fallback","resolved_to":"crossframe-promax"},"run_id":"promax-green-v3-gpt-5-6-sol-a1-f2bde4ebcefa435fbf4be12cf278730b","run_nonce":"74e5c25309009d718c6d8ff21a09964258b6f8adf8350192df190c0cf3c84962","schema_id":"crossframe.promax.v8.run-contract","schema_version":1,"source_snapshot_sha256":"3186805a3e46e1b16948a4e51d08e7693a8e0dd04aa6b4604e796266d649936c"}
